{
  "schema": "af/telemetry-search@1",
  "directory": "<root>",
  "index": {
    "state": "fresh"
  },
  "query": "lighthouse",
  "matches": [
    {
      "digest": "sha256:735a7d3d98e961ed6b22fb107cc132cb9fc0755cb56d20a65edab8f3ccc5bd7b",
      "excerpt": "{\"schema\":\"af.worker-request/1\",\"instructions\":\"Review the lighthouse.\",\"inputs\":{\"source\":[{\"artifact_id\":\"sha256:aaaaaaaaaaaaaaaaaaaaaaaaaaaaaaaaaaaaaaaaaaaaaaaaaaaaaaaaaaaaaaaa\",\"artifact_type\":\"af/SourceTree@1\",\"snapshot_id\":\"sha256:bbbbbbbbbbbbbbbbbbbbbbbbbbbbbbbbbbbbbbbbbbbbbbbbbbbbbbbbbbbbbbbb…",
      "occurrences": [
        {
          "occurrence_id": "1700000400000-4246-2b3c4d5e:8",
          "event": "gen_ai.content.input",
          "time_unix_ns": "1700000400007000000",
          "span_id": "02898a9d195c61b3",
          "span_path": [
            "af.command",
            "af.run",
            "af.node",
            "af.attempt",
            "af.context.compose"
          ],
          "store_id": "6767676767676767676767676767676767676767676767676767676767676767",
          "run_id": "task:sha256:9898989898989898989898989898989898989898989898989898989898989898",
          "attempt_id": "golden-content-attempt-1"
        }
      ],
      "more_occurrences": false
    },
    {
      "digest": "sha256:73f17eee3a3d55939e6c86cb93cb026c1f3d51d9886d47008f365c79c9eacdf4",
      "excerpt": "No findings: the periwinkle lighthouse is lit.",
      "occurrences": [
        {
          "occurrence_id": "1700000400000-4246-2b3c4d5e:35",
          "event": "gen_ai.content.output",
          "time_unix_ns": "1700000400015000000",
          "span_id": "cd041af7452bf2a6",
          "span_path": [
            "af.command",
            "af.run",
            "af.node",
            "af.attempt",
            "af.harness",
            "af.turn"
          ],
          "store_id": "6767676767676767676767676767676767676767676767676767676767676767",
          "run_id": "task:sha256:9898989898989898989898989898989898989898989898989898989898989898",
          "attempt_id": "golden-content-attempt-1"
        }
      ],
      "more_occurrences": false
    }
  ],
  "more": false,
  "unreadable": []
}
